[
  {
    "id": "abraham-maslow__associated-with__hierarchie-potreb",
    "fromId": "abraham-maslow",
    "toId": "hierarchie-potreb",
    "type": "associated-with",
    "strength": "secondary",
    "direction": "forward",
    "studyPriority": "important",
    "suitableForContrast": false,
    "explanation": "Zdroj osobnost s tímto pojmem nebo jevem výslovně spojuje.",
    "tags": [
      "motivace",
      "psychologie-psychiatrie-a-psychoterapie"
    ],
    "sourceReferences": [
      {
        "sourceDocumentId": "mini-wikipedie-osobnosti-vs",
        "locator": "Abraham Maslow",
        "excerpt": "Je známý hierarchií potřeb a pojmem seberealizace."
      }
    ]
  },
  {
    "id": "adolf-meyer__developed__psychobiologicky-pristup",
    "fromId": "adolf-meyer",
    "toId": "psychobiologicky-pristup",
    "type": "developed",
    "strength": "primary",
    "direction": "forward",
    "studyPriority": "context",
    "suitableForContrast": false,
    "explanation": "Zdroj osobnost s tímto postupem nebo pojetím výslovně spojuje.",
    "tags": [
      "psychiatrie",
      "psychologie-psychiatrie-a-psychoterapie"
    ],
    "sourceReferences": [
      {
        "sourceDocumentId": "mini-wikipedie-osobnosti-vs",
        "locator": "Adolf Meyer",
        "excerpt": "Psychiatr spojený s psychobiologickým přístupem, který zdůrazňoval životníhistorii člověka a vliv prostředí na psychický stav."
      }
    ]
  },
  {
    "id": "ake-w-edfeldt__associated-with__specialnepedagogicka-diagnostika",
    "fromId": "ake-w-edfeldt",
    "toId": "specialnepedagogicka-diagnostika",
    "type": "associated-with",
    "strength": "secondary",
    "direction": "forward",
    "studyPriority": "important",
    "suitableForContrast": false,
    "explanation": "Zdroj osobnost s tímto pojmem nebo jevem výslovně spojuje.",
    "tags": [
      "diagnostika",
      "diagnostika-a-psychometrie"
    ],
    "sourceReferences": [
      {
        "sourceDocumentId": "mini-wikipedie-osobnosti-vs",
        "locator": "Åke W. Edfeldt",
        "excerpt": "Jeho jméno patří k faktografii speciálněpedagogické diagnostiky, zejména voblasti čtenářské připravenosti."
      }
    ]
  },
  {
    "id": "ake-w-edfeldt__developed__reverzni-test",
    "fromId": "ake-w-edfeldt",
    "toId": "reverzni-test",
    "type": "developed",
    "strength": "primary",
    "direction": "forward",
    "studyPriority": "important",
    "suitableForContrast": false,
    "explanation": "Zdroj osobnost s tímto testem nebo škálou výslovně spojuje.",
    "tags": [
      "ctenarska-pripravenost",
      "diagnostika",
      "diagnostika-a-psychometrie"
    ],
    "sourceReferences": [
      {
        "sourceDocumentId": "mini-wikipedie-osobnosti-vs",
        "locator": "Åke W. Edfeldt",
        "excerpt": "Autor reverzního testu využívaného při posuzování zrakově-prostorovéhozpracování a předpokladů pro osvojování čtení."
      }
    ]
  },
  {
    "id": "albert-bandura__associated-with__self-efficacy",
    "fromId": "albert-bandura",
    "toId": "self-efficacy",
    "type": "associated-with",
    "strength": "secondary",
    "direction": "forward",
    "studyPriority": "important",
    "suitableForContrast": false,
    "explanation": "Zdroj osobnost s tímto pojmem nebo jevem výslovně spojuje.",
    "tags": [
      "motivace",
      "psychologie-psychiatrie-a-psychoterapie",
      "uceni"
    ],
    "sourceReferences": [
      {
        "sourceDocumentId": "mini-wikipedie-osobnosti-vs",
        "locator": "Albert Bandura",
        "excerpt": "Psycholog známý teorií sociálního učení, modelováním a pojmem self-efficacy."
      }
    ]
  },
  {
    "id": "alexandr-kapp__associated-with__andragogika",
    "fromId": "alexandr-kapp",
    "toId": "andragogika",
    "type": "associated-with",
    "strength": "secondary",
    "direction": "forward",
    "studyPriority": "important",
    "suitableForContrast": false,
    "explanation": "Zdroj osobnost s tímto pojmem nebo jevem výslovně spojuje.",
    "tags": [
      "andragogika-a-gerontagogika",
      "vymezeni-oboru"
    ],
    "sourceReferences": [
      {
        "sourceDocumentId": "mini-wikipedie-osobnosti-vs",
        "locator": "Alexandr Kapp",
        "excerpt": "Osobnost spojovaná s prvním doloženým užitím pojmu andragogika v roce 1833."
      }
    ]
  },
  {
    "id": "alfred-adler__developed__individualni-psychologie",
    "fromId": "alfred-adler",
    "toId": "individualni-psychologie",
    "type": "developed",
    "strength": "primary",
    "direction": "forward",
    "studyPriority": "core",
    "suitableForContrast": false,
    "explanation": "Zdroj osobnost s tímto postupem nebo pojetím výslovně spojuje.",
    "tags": [
      "psychologie-psychiatrie-a-psychoterapie",
      "psychoterapie"
    ],
    "sourceReferences": [
      {
        "sourceDocumentId": "mini-wikipedie-osobnosti-vs",
        "locator": "Alfred Adler",
        "excerpt": "Rakouský psycholog a zakladatel individuální psychologie."
      }
    ]
  },
  {
    "id": "alfred-binet__co-authored__theodore-simon",
    "fromId": "alfred-binet",
    "toId": "theodore-simon",
    "type": "co-authored",
    "strength": "primary",
    "direction": "forward",
    "studyPriority": "important",
    "suitableForContrast": true,
    "explanation": "Zdroj uvádí, že Alfred Binet spolu s Théodorem Simonem vytvořil Binet-Simonovu škálu.",
    "tags": [
      "historie-oboru"
    ],
    "sourceReferences": [
      {
        "sourceDocumentId": "mini-wikipedie-osobnosti-vs",
        "locator": "Alfred Binet",
        "excerpt": "Zdroj uvádí, že Alfred Binet spolu s Théodorem Simonem vytvořil Binet-Simonovu škálu."
      }
    ]
  },
  {
    "id": "alfred-binet__developed__binet-simonova-skala",
    "fromId": "alfred-binet",
    "toId": "binet-simonova-skala",
    "type": "developed",
    "strength": "primary",
    "direction": "forward",
    "studyPriority": "core",
    "suitableForContrast": true,
    "explanation": "Zdroj uvádí, že Alfred Binet spolu s Théodorem Simonem vytvořil Binet-Simonovu škálu.",
    "tags": [
      "diagnostika",
      "diagnostika-a-psychometrie",
      "psychometrie"
    ],
    "sourceReferences": [
      {
        "sourceDocumentId": "mini-wikipedie-osobnosti-vs",
        "locator": "Alfred Binet",
        "excerpt": "Spolu s Théodorem Simonem vytvořil Binet-Simonovu škálu určenou k rozlišenídětí, které potřebují zvláštní školní podporu."
      }
    ]
  },
  {
    "id": "alfred-binet__revised__stanford-binet",
    "fromId": "alfred-binet",
    "toId": "stanford-binet",
    "type": "revised",
    "strength": "primary",
    "direction": "forward",
    "studyPriority": "core",
    "suitableForContrast": true,
    "explanation": "Zdroj osobnost je ve zdroji spojena s revizí tohoto nástroje.",
    "tags": [
      "diagnostika",
      "diagnostika-a-psychometrie",
      "psychometrie"
    ],
    "sourceReferences": [
      {
        "sourceDocumentId": "mini-wikipedie-osobnosti-vs",
        "locator": "Alfred Binet",
        "excerpt": "Jeho jméno se spojuje také s pozdější stanfordskou revizí, známou jakoStanford–Binet."
      }
    ]
  },
  {
    "id": "alois-zikmund__associated-with__mravne-ohrozena-narusena-a-vadna-mladez",
    "fromId": "alois-zikmund",
    "toId": "mravne-ohrozena-narusena-a-vadna-mladez",
    "type": "associated-with",
    "strength": "secondary",
    "direction": "forward",
    "studyPriority": "core",
    "suitableForContrast": false,
    "explanation": "Zdroj osobnost s tímto pojmem nebo jevem výslovně spojuje.",
    "tags": [
      "etopedie",
      "historie-oboru",
      "vymezeni-oboru"
    ],
    "sourceReferences": [
      {
        "sourceDocumentId": "mini-wikipedie-osobnosti-vs",
        "locator": "Alois Zikmund",
        "excerpt": "Ve vychovatelně v Opatovicích členil mládež na mravně ohroženou, mravněnarušenou a mravně vadnou."
      }
    ]
  },
  {
    "id": "alois-zikmund__associated-with__vychovatelna-v-opatovicich",
    "fromId": "alois-zikmund",
    "toId": "vychovatelna-v-opatovicich",
    "type": "associated-with",
    "strength": "secondary",
    "direction": "forward",
    "studyPriority": "core",
    "suitableForContrast": false,
    "explanation": "Zdroj osobnost s touto institucí výslovně spojuje.",
    "tags": [
      "ceske-prostredi",
      "etopedie",
      "instituce"
    ],
    "sourceReferences": [
      {
        "sourceDocumentId": "mini-wikipedie-osobnosti-vs",
        "locator": "Alois Zikmund",
        "excerpt": "Ve vychovatelně v Opatovicích členil mládež na mravně ohroženou, mravněnarušenou a mravně vadnou."
      }
    ]
  },
  {
    "id": "alzbeta-peutelschmiedova__associated-with__koktavost",
    "fromId": "alzbeta-peutelschmiedova",
    "toId": "koktavost",
    "type": "associated-with",
    "strength": "secondary",
    "direction": "forward",
    "studyPriority": "important",
    "suitableForContrast": false,
    "explanation": "Zdroj osobnost s touto diagnostickou kategorií výslovně spojuje.",
    "tags": [
      "novodoba-ceska-tradice-a-institucni-rozvoj",
      "plynulost-reci"
    ],
    "sourceReferences": [
      {
        "sourceDocumentId": "mini-wikipedie-osobnosti-vs",
        "locator": "Alžběta Peutelschmiedová",
        "excerpt": "Česká logopedka a odbornice na koktavost patřící k výrazným osobnostem novodobéčeské logopedie."
      }
    ]
  },
  {
    "id": "arab-al-amidi__associated-with__hmatove-rozlisitelne-znaky",
    "fromId": "arab-al-amidi",
    "toId": "hmatove-rozlisitelne-znaky",
    "type": "associated-with",
    "strength": "secondary",
    "direction": "forward",
    "studyPriority": "important",
    "suitableForContrast": true,
    "explanation": "Zdroj osobnost s tímto systémem výslovně spojuje.",
    "tags": [
      "historie-oboru",
      "komunikace",
      "tyflopedie"
    ],
    "sourceReferences": [
      {
        "sourceDocumentId": "mini-wikipedie-osobnosti-vs",
        "locator": "Arab al-Amidi",